{
  "adapter_version": "manual-record-v1",
  "captured_by": "fixture-operator",
  "evidence_id": "ev-7c32d25c1fe28c2d9ce3570f3fd5be35ea714d6fc46942ce71a5806a4339166f",
  "facts_id": "fact-216477e901a854be0273743350082206d852951daaaa5fab48dcaa9bd39cfe41",
  "normalizer_version": "normalizer-v1",
  "observation": {
    "coupon_codes": [],
    "currency": "VND",
    "eligibility": {
      "notes": null,
      "scope": "all_users"
    },
    "evidence": {
      "fetched_at": "2026-09-25T00:00:00.000000Z",
      "payload_sha256": "1377efc8216c5b77b2779341462054ba6bd93f6a41080d9aa249170265a6f7e7",
      "source_url": "https://example.com/source"
    },
    "external_offer_id": "offer-demo-001",
    "item_id": "item-demo-001",
    "list_price_minor": 100000,
    "market": "VN",
    "merchant_id": "merchant-demo-001",
    "observation_id": "obs-1377efc8216c5b77b2779341462054ba",
    "observed_at": "2026-09-25T00:00:00.000000Z",
    "platform": "shopee",
    "product_url": "https://example.com/products/item-demo-001",
    "sale_price_minor": 80000,
    "schema_version": "offer-observation.v1",
    "shipping_price_minor": null,
    "source_method": "manual",
    "stock_status": "in_stock",
    "title": "Sản phẩm minh họa không phải dữ liệu thật",
    "variant_id": "blue-128"
  },
  "sale_price_scope": "unconditional",
  "schema_version": "deal-facts.v1",
  "valid_until": "2026-09-25T02:00:00.000000Z",
  "variant_scope": "explicit_variant",
  "verified_total": null
}
